{"canonical_payloads":[{"identity":"tuppi.engine.player_observation.v1","schema_ref":"https://example.invalid/tuppi/schemas/engine/player_observation.schema.json"},{"identity":"tuppi.engine.public_event.v1","schema_ref":"https://example.invalid/tuppi/schemas/engine/public_event_log.schema.json#/$defs/event"},{"identity":"tuppi.engine.match_result.v1","schema_ref":"https://example.invalid/tuppi/schemas/engine/match_result.schema.json"}],"messages":[{"direction":"server_to_client","id":"compatibility_result","schema_ref":"https://example.invalid/tuppi/schemas/network/http_api.schema.json#/$defs/compatibilityResult","transport":"http"},{"direction":"client_to_server","id":"create_room_request","schema_ref":"https://example.invalid/tuppi/schemas/network/http_api.schema.json#/$defs/createRoomRequest","transport":"http"},{"direction":"server_to_client","id":"create_room_result","schema_ref":"https://example.invalid/tuppi/schemas/network/http_api.schema.json#/$defs/roomBootstrap","transport":"http"},{"direction":"client_to_server","id":"join_room_request","schema_ref":"https://example.invalid/tuppi/schemas/network/http_api.schema.json#/$defs/joinRoomRequest","transport":"http"},{"direction":"server_to_client","id":"join_room_result","schema_ref":"https://example.invalid/tuppi/schemas/network/http_api.schema.json#/$defs/roomBootstrap","transport":"http"},{"direction":"client_to_server","id":"configure_room_request","schema_ref":"https://example.invalid/tuppi/schemas/network/http_api.schema.json#/$defs/configureRoomRequest","transport":"http"},{"direction":"server_to_client","id":"configure_room_result","schema_ref":"https://example.invalid/tuppi/schemas/network/http_api.schema.json#/$defs/roomStatusResponse","transport":"http"},{"direction":"client_to_server","id":"ready_request","schema_ref":"https://example.invalid/tuppi/schemas/network/http_api.schema.json#/$defs/sessionRequest","transport":"http"},{"direction":"server_to_client","id":"ready_result","schema_ref":"https://example.invalid/tuppi/schemas/network/http_api.schema.json#/$defs/roomStatusResponse","transport":"http"},{"direction":"client_to_server","id":"analysis_request","schema_ref":"https://example.invalid/tuppi/schemas/network/http_api.schema.json#/$defs/sessionRequest","transport":"http"},{"direction":"server_to_client","id":"analysis_result","schema_ref":"https://example.invalid/tuppi/schemas/network/post_match_analysis.schema.json","transport":"http"},{"direction":"server_to_client","id":"server_error","schema_ref":"https://example.invalid/tuppi/schemas/network/http_api.schema.json#/$defs/serverError","transport":"http"},{"direction":"client_to_server","id":"hello","schema_ref":"https://example.invalid/tuppi/schemas/network/websocket_message.schema.json#/$defs/hello","transport":"websocket"},{"direction":"server_to_client","id":"hello_ack","schema_ref":"https://example.invalid/tuppi/schemas/network/websocket_message.schema.json#/$defs/helloAcknowledgement","transport":"websocket"},{"direction":"server_to_client","id":"ws_compatibility_result","schema_ref":"https://example.invalid/tuppi/schemas/network/websocket_message.schema.json#/$defs/compatibilityResult","transport":"websocket"},{"direction":"server_to_client","id":"lobby_snapshot","schema_ref":"https://example.invalid/tuppi/schemas/network/websocket_message.schema.json#/$defs/lobbySnapshot","transport":"websocket"},{"direction":"client_to_server","id":"ready","schema_ref":"https://example.invalid/tuppi/schemas/network/websocket_message.schema.json#/$defs/ready","transport":"websocket"},{"direction":"server_to_client","id":"match_update","schema_ref":"https://example.invalid/tuppi/schemas/network/websocket_message.schema.json#/$defs/matchUpdate","transport":"websocket"},{"direction":"client_to_server","id":"action_submission","schema_ref":"https://example.invalid/tuppi/schemas/network/websocket_message.schema.json#/$defs/actionSubmission","transport":"websocket"},{"direction":"server_to_client","id":"action_acknowledgement","schema_ref":"https://example.invalid/tuppi/schemas/network/websocket_message.schema.json#/$defs/actionAcknowledgement","transport":"websocket"},{"direction":"client_to_server","id":"reconnect","schema_ref":"https://example.invalid/tuppi/schemas/network/websocket_message.schema.json#/$defs/reconnect","transport":"websocket"},{"direction":"server_to_client","id":"reconnect_result","schema_ref":"https://example.invalid/tuppi/schemas/network/websocket_message.schema.json#/$defs/reconnectResult","transport":"websocket"},{"direction":"server_to_client","id":"protocol_error","schema_ref":"https://example.invalid/tuppi/schemas/network/websocket_message.schema.json#/$defs/protocolError","transport":"websocket"},{"direction":"client_to_server","id":"ping","schema_ref":"https://example.invalid/tuppi/schemas/network/websocket_message.schema.json#/$defs/ping","transport":"websocket"},{"direction":"server_to_client","id":"pong","schema_ref":"https://example.invalid/tuppi/schemas/network/websocket_message.schema.json#/$defs/pong","transport":"websocket"}],"protocol_version":"tuppi.network.v1","ruleset_id":"project_target_v1","schema_version":"tuppi.network.protocol_manifest.v1"}
