{
  "schema_version": "tuppi.network.protocol_manifest.v1",
  "protocol_version": "tuppi.network.v1",
  "ruleset_id": "project_target_v1",
  "canonical_payloads": [
    {"identity": "tuppi.engine.player_observation.v1", "schema_ref": "https://example.invalid/tuppi/schemas/engine/player_observation.schema.json"},
    {"identity": "tuppi.engine.public_event.v1", "schema_ref": "https://example.invalid/tuppi/schemas/engine/public_event_log.schema.json#/$defs/event"},
    {"identity": "tuppi.engine.match_result.v1", "schema_ref": "https://example.invalid/tuppi/schemas/engine/match_result.schema.json"}
  ],
  "messages": [
    {"id": "compatibility_result", "transport": "http", "direction": "server_to_client", "schema_ref": "https://example.invalid/tuppi/schemas/network/http_api.schema.json#/$defs/compatibilityResult"},
    {"id": "create_room_request", "transport": "http", "direction": "client_to_server", "schema_ref": "https://example.invalid/tuppi/schemas/network/http_api.schema.json#/$defs/createRoomRequest"},
    {"id": "create_room_result", "transport": "http", "direction": "server_to_client", "schema_ref": "https://example.invalid/tuppi/schemas/network/http_api.schema.json#/$defs/roomBootstrap"},
    {"id": "join_room_request", "transport": "http", "direction": "client_to_server", "schema_ref": "https://example.invalid/tuppi/schemas/network/http_api.schema.json#/$defs/joinRoomRequest"},
    {"id": "join_room_result", "transport": "http", "direction": "server_to_client", "schema_ref": "https://example.invalid/tuppi/schemas/network/http_api.schema.json#/$defs/roomBootstrap"},
    {"id": "configure_room_request", "transport": "http", "direction": "client_to_server", "schema_ref": "https://example.invalid/tuppi/schemas/network/http_api.schema.json#/$defs/configureRoomRequest"},
    {"id": "configure_room_result", "transport": "http", "direction": "server_to_client", "schema_ref": "https://example.invalid/tuppi/schemas/network/http_api.schema.json#/$defs/roomStatusResponse"},
    {"id": "ready_request", "transport": "http", "direction": "client_to_server", "schema_ref": "https://example.invalid/tuppi/schemas/network/http_api.schema.json#/$defs/sessionRequest"},
    {"id": "ready_result", "transport": "http", "direction": "server_to_client", "schema_ref": "https://example.invalid/tuppi/schemas/network/http_api.schema.json#/$defs/roomStatusResponse"},
    {"id": "analysis_request", "transport": "http", "direction": "client_to_server", "schema_ref": "https://example.invalid/tuppi/schemas/network/http_api.schema.json#/$defs/sessionRequest"},
    {"id": "analysis_result", "transport": "http", "direction": "server_to_client", "schema_ref": "https://example.invalid/tuppi/schemas/network/post_match_analysis.schema.json"},
    {"id": "server_error", "transport": "http", "direction": "server_to_client", "schema_ref": "https://example.invalid/tuppi/schemas/network/http_api.schema.json#/$defs/serverError"},
    {"id": "hello", "transport": "websocket", "direction": "client_to_server", "schema_ref": "https://example.invalid/tuppi/schemas/network/websocket_message.schema.json#/$defs/hello"},
    {"id": "hello_ack", "transport": "websocket", "direction": "server_to_client", "schema_ref": "https://example.invalid/tuppi/schemas/network/websocket_message.schema.json#/$defs/helloAcknowledgement"},
    {"id": "ws_compatibility_result", "transport": "websocket", "direction": "server_to_client", "schema_ref": "https://example.invalid/tuppi/schemas/network/websocket_message.schema.json#/$defs/compatibilityResult"},
    {"id": "lobby_snapshot", "transport": "websocket", "direction": "server_to_client", "schema_ref": "https://example.invalid/tuppi/schemas/network/websocket_message.schema.json#/$defs/lobbySnapshot"},
    {"id": "ready", "transport": "websocket", "direction": "client_to_server", "schema_ref": "https://example.invalid/tuppi/schemas/network/websocket_message.schema.json#/$defs/ready"},
    {"id": "match_update", "transport": "websocket", "direction": "server_to_client", "schema_ref": "https://example.invalid/tuppi/schemas/network/websocket_message.schema.json#/$defs/matchUpdate"},
    {"id": "action_submission", "transport": "websocket", "direction": "client_to_server", "schema_ref": "https://example.invalid/tuppi/schemas/network/websocket_message.schema.json#/$defs/actionSubmission"},
    {"id": "action_acknowledgement", "transport": "websocket", "direction": "server_to_client", "schema_ref": "https://example.invalid/tuppi/schemas/network/websocket_message.schema.json#/$defs/actionAcknowledgement"},
    {"id": "reconnect", "transport": "websocket", "direction": "client_to_server", "schema_ref": "https://example.invalid/tuppi/schemas/network/websocket_message.schema.json#/$defs/reconnect"},
    {"id": "reconnect_result", "transport": "websocket", "direction": "server_to_client", "schema_ref": "https://example.invalid/tuppi/schemas/network/websocket_message.schema.json#/$defs/reconnectResult"},
    {"id": "protocol_error", "transport": "websocket", "direction": "server_to_client", "schema_ref": "https://example.invalid/tuppi/schemas/network/websocket_message.schema.json#/$defs/protocolError"},
    {"id": "ping", "transport": "websocket", "direction": "client_to_server", "schema_ref": "https://example.invalid/tuppi/schemas/network/websocket_message.schema.json#/$defs/ping"},
    {"id": "pong", "transport": "websocket", "direction": "server_to_client", "schema_ref": "https://example.invalid/tuppi/schemas/network/websocket_message.schema.json#/$defs/pong"}
  ]
}
